{
  "$schema": "http://json-schema.org/draft-07/schema#",
  "$id": "https://smart-campus.edu/schemas/room-personality.json",
  "title": "Room Personality Profile",
  "description": "AI-ready personality profile for Smart Campus rooms",
  "type": "object",
  "required": ["id", "name", "category", "personality"],
  "properties": {
    "id": {
      "type": "string",
      "description": "Unique room identifier (matches roomRegistry.id)",
      "examples": ["b.3", "library", "makerspace"]
    },
    "name": {
      "type": "string",
      "description": "Human-readable room name",
      "examples": ["Peace", "Alexandria", "Makers Space"]
    },
    "category": {
      "type": "string",
      "enum": [
        "Classroom",
        "Lab",
        "Common",
        "Service",
        "Community Hubs",
        "Conceptual Realms",
        "Innovation & Discovery",
        "Creative Core",
        "Data Core",
        "Elemental Forces",
        "Mythos & Media"
      ],
      "description": "Room category for grouping and filtering"
    },
    "personality": {
      "type": "object",
      "required": ["avatar", "tone", "traits"],
      "properties": {
        "avatar": {
          "type": "string",
          "description": "Persona name for AI interactions",
          "examples": ["Pax", "The Archivist", "The Tinkerer"]
        },
        "icon": {
          "type": "string",
          "description": "Unicode emoji representing the room",
          "examples": ["üïäÔ∏è", "üìú", "üõ†Ô∏è"]
        },
        "tone": {
          "type": "string",
          "enum": ["professional", "casual", "playful", "serious", "inspiring", "calming", "energetic"],
          "description": "Communication style for AI-generated responses"
        },
        "traits": {
          "type": "array",
          "items": {
            "type": "string"
          },
          "description": "Personality characteristics",
          "examples": [["peaceful", "introspective", "quiet"], ["collaborative", "energetic", "creative"]]
        },
        "preferred_interaction_style": {
          "type": "string",
          "enum": ["text", "voice", "mixed"],
          "default": "mixed"
        },
        "topics_of_interest": {
          "type": "array",
          "items": {
            "type": "string"
          },
          "description": "Preferred discussion topics for AI context",
          "examples": [["meditation", "philosophy", "quiet study"], ["making", "prototyping", "electronics"]]
        },
        "backstory": {
          "type": "string",
          "description": "Optional narrative context for AI persona",
          "maxLength": 500
        }
      }
    },
    "physical_attributes": {
      "type": "object",
      "properties": {
        "capacity": {
          "type": "integer",
          "minimum": 1,
          "description": "Maximum occupancy"
        },
        "area_sqm": {
          "type": "number",
          "minimum": 0,
          "description": "Floor area in square meters"
        },
        "layout": {
          "type": "string",
          "enum": ["classroom", "lecture_hall", "lab", "open_space", "booth", "lounge"],
          "description": "Physical layout type"
        },
        "equipment": {
          "type": "array",
          "items": {
            "type": "object",
            "properties": {
              "type": {
                "type": "string",
                "examples": ["projector", "whiteboard", "3d_printer", "laptops"]
              },
              "quantity": {
                "type": "integer",
                "minimum": 1
              },
              "status": {
                "type": "string",
                "enum": ["available", "in_use", "maintenance", "unavailable"]
              }
            }
          }
        },
        "accessibility": {
          "type": "object",
          "properties": {
            "wheelchair_accessible": { "type": "boolean" },
            "hearing_loop": { "type": "boolean" },
            "adjustable_lighting": { "type": "boolean" }
          }
        }
      }
    },
    "sensors": {
      "type": "object",
      "properties": {
        "available": {
          "type": "array",
          "items": {
            "type": "string",
            "enum": ["temperature", "humidity", "co2", "air_quality", "illumination", "occupancy", "noise"]
          },
          "description": "Sensors installed in this room"
        },
        "entity_ids": {
          "type": "array",
          "items": {
            "type": "string"
          },
          "description": "Home Assistant entity IDs for room sensors"
        }
      }
    },
    "typical_activities": {
      "type": "array",
      "items": {
        "type": "object",
        "properties": {
          "name": { "type": "string" },
          "frequency": {
            "type": "string",
            "enum": ["daily", "weekly", "monthly", "occasional"]
          },
          "time_of_day": {
            "type": "array",
            "items": {
              "type": "string",
              "enum": ["morning", "afternoon", "evening", "night"]
            }
          }
        }
      },
      "description": "Common activities for AI context"
    },
    "metadata": {
      "type": "object",
      "properties": {
        "created_at": { "type": "string", "format": "date-time" },
        "updated_at": { "type": "string", "format": "date-time" },
        "version": { "type": "string" },
        "tags": {
          "type": "array",
          "items": { "type": "string" }
        }
      }
    }
  }
}
